{
  "$schema": "https://json-schema.org/draft/2020-12/schema",
  "$id": "https://raw.githubusercontent.com/rainhuang0220/whereToken/main/docs/cli-json.schema.json",
  "title": "wheretoken --json",
  "description": "Schema 1 stdout for `wheretoken --json`. Tables stay the default. No events, turns payloads, timestamps, or secrets. total stays an integer so existing readers keep working. It is a measurement only when tokens_known is true. When tokens_known is false, total, today, and peak_day stay 0 and are not a measured zero; read total_m and coverage. A measured zero is tokens_known true, coverage available, and total 0. The dashboard reads scan summary JSON, not this schema.",
  "type": "object",
  "additionalProperties": false,
  "required": [
    "schema",
    "period",
    "total",
    "total_m",
    "tokens_known",
    "coverage",
    "hit_rate",
    "hit_rate_text",
    "requests",
    "user_turns",
    "tools",
    "vendors",
    "notes"
  ],
  "properties": {
    "schema": { "type": "integer", "const": 1 },
    "period": { "type": "string" },
    "scope": { "type": "string" },
    "total": {
      "type": "integer",
      "description": "Token sum. A measurement only when tokens_known is true. When tokens_known is false this stays 0 and is not a measured zero."
    },
    "total_m": { "type": "string" },
    "tokens_known": { "type": "boolean" },
    "coverage": { "type": "string", "enum": ["available", "partial", "unavailable"] },
    "hit_rate": { "type": ["number", "null"] },
    "hit_rate_text": { "type": "string" },
    "max_streak_days": { "type": "integer", "minimum": 0 },
    "current_streak_days": { "type": "integer", "minimum": 0 },
    "requests": { "type": "integer", "minimum": 0 },
    "user_turns": { "type": "integer", "minimum": 0 },
    "hide_turns": { "type": "boolean" },
    "last_7d": {
      "type": "array",
      "items": { "type": "integer" },
      "minItems": 7,
      "maxItems": 7
    },
    "today": { "type": "integer", "minimum": 0 },
    "today_m": { "type": "string" },
    "peak_day": { "type": "integer", "minimum": 0 },
    "peak_day_m": { "type": "string" },
    "tools": { "type": "array", "items": { "$ref": "#/$defs/row" } },
    "vendors": { "type": "array", "items": { "$ref": "#/$defs/row" } },
    "models": { "type": "array", "items": { "$ref": "#/$defs/row" } },
    "notes": { "type": "array", "items": { "type": "string" } },
    "cost_status": { "type": "string", "enum": ["complete", "partial", "unavailable"] },
    "cost_usd": { "type": "string" },
    "community": { "$ref": "#/$defs/community" }
  },
  "$defs": {
    "row": {
      "type": "object",
      "additionalProperties": false,
      "required": ["id", "label", "total", "total_m", "tokens_known", "coverage", "hit_rate_text", "requests"],
      "properties": {
        "id": { "type": "string" },
        "label": { "type": "string" },
        "total": {
          "type": "integer",
          "description": "Token sum for this row. A measurement only when tokens_known is true."
        },
        "total_m": { "type": "string" },
        "tokens_known": { "type": "boolean" },
        "coverage": { "type": "string", "enum": ["available", "partial", "unavailable"] },
        "share": { "type": "string" },
        "hit_rate_text": { "type": "string" },
        "requests": { "type": "integer", "minimum": 0 },
        "user_turns": { "type": "integer", "minimum": 0 },
        "cost_status": { "type": "string", "enum": ["complete", "partial", "unavailable"] },
        "cost_usd": { "type": "string" }
      }
    },
    "community": {
      "type": "object",
      "additionalProperties": false,
      "properties": {
        "enabled": { "type": "boolean" },
        "metric": { "type": "string" },
        "self_reported": { "type": "boolean" },
        "note": { "type": "string" },
        "today": { "$ref": "#/$defs/standing" },
        "all": { "$ref": "#/$defs/standing" }
      }
    },
    "standing": {
      "type": "object",
      "additionalProperties": false,
      "required": ["status"],
      "properties": {
        "status": {
          "type": "string",
          "enum": [
            "ok",
            "unavailable",
            "not_ranked",
            "insufficient_participants",
            "opted_out",
            "offline",
            "disabled",
            "no_usage",
            "service_unconfigured",
            "network_error"
          ]
        },
        "period": { "type": "string" },
        "metric": { "type": "string" },
        "rank": { "type": "integer", "minimum": 1 },
        "participants": { "type": "integer", "minimum": 1 },
        "percentile": { "type": "number" },
        "top_share": { "type": "number" },
        "display": { "type": "string" },
        "note": { "type": "string" },
        "self_reported": { "type": "boolean" }
      }
    }
  }
}
