{
  "schema": 1,
  "period": "有账本以来",
  "total": 11680000,
  "total_m": "11.68 M",
  "tokens_known": true,
  "coverage": "available",
  "hit_rate": 85.21739130434783,
  "hit_rate_text": "85.2%",
  "max_streak_days": 2,
  "current_streak_days": 2,
  "requests": 3,
  "user_turns": 3,
  "last_7d": [
    0,
    0,
    0,
    0,
    0,
    10100000,
    1580000
  ],
  "today": 1580000,
  "today_m": "1.58 M",
  "peak_day": 10100000,
  "peak_day_m": "10.10 M",
  "tools": [
    {
      "id": "claude",
      "label": "Claude Code",
      "total": 10650000,
      "total_m": "10.65 M",
      "tokens_known": true,
      "coverage": "available",
      "share": "91.2%",
      "hit_rate_text": "85.7%",
      "requests": 2,
      "user_turns": 2,
      "cost_status": "partial",
      "cost_usd": "$12.0000"
    },
    {
      "id": "kimi",
      "label": "Kimi Code",
      "total": 1030000,
      "total_m": "1.03 M",
      "tokens_known": true,
      "coverage": "available",
      "share": "8.8%",
      "hit_rate_text": "80.0%",
      "requests": 1,
      "user_turns": 1,
      "cost_status": "unavailable"
    }
  ],
  "vendors": [
    {
      "id": "anthropic",
      "label": "Anthropic",
      "total": 10100000,
      "total_m": "10.10 M",
      "tokens_known": true,
      "coverage": "available",
      "share": "86.5%",
      "hit_rate_text": "90.0%",
      "requests": 1,
      "cost_status": "complete",
      "cost_usd": "$12.0000"
    },
    {
      "id": "moonshot",
      "label": "Moonshot",
      "total": 1030000,
      "total_m": "1.03 M",
      "tokens_known": true,
      "coverage": "available",
      "share": "8.8%",
      "hit_rate_text": "80.0%",
      "requests": 1,
      "cost_status": "unavailable"
    },
    {
      "id": "minimax",
      "label": "MiniMax",
      "total": 550000,
      "total_m": "0.55 M",
      "tokens_known": true,
      "coverage": "available",
      "share": "4.7%",
      "hit_rate_text": "0.0%",
      "requests": 1,
      "cost_status": "unavailable"
    }
  ],
  "notes": [
    "估价 $12.0000 · 部分模型没有标价，未计入；不是订阅账单"
  ],
  "cost_status": "partial",
  "cost_usd": "$12.0000"
}
